{
  "schema_version": "parallax-signature-pack/v1",
  "id": "parallax.binary-imports",
  "name": "Binary import-symbol surfaces",
  "version": "0.2.0",
  "status": "draft",
  "signatures": [
    {
      "id": "sig.binary-import.exec-inject",
      "atom": "EXEC.INJECT",
      "surface": "binary-import",
      "method": "static-binary",
      "languages": [
        "*"
      ],
      "match": {
        "mode": "substring",
        "values": [
          "virtualallocex",
          "writeprocessmemory",
          "createremotethread",
          "ntmapviewofsection",
          "ptrace",
          "task_for_pid"
        ]
      },
      "confidence": 0.55,
      "summary": "process-injection primitive",
      "notes": "Extracted from bincaps.py _CAP_MAP."
    },
    {
      "id": "sig.binary-import.crpt-keyload",
      "atom": "CRPT.KEYLOAD",
      "surface": "binary-import",
      "method": "static-binary",
      "languages": [
        "*"
      ],
      "match": {
        "mode": "exact",
        "values": [
          "pem_read_bio_privatekey",
          "pem_read_bio_privatekey_ex",
          "pem_read_privatekey",
          "pem_read_privatekey_ex",
          "pem_read_bio_pubkey",
          "pem_read_bio_pubkey_ex",
          "d2i_privatekey",
          "d2i_autoprivatekey"
        ],
        "normalize": [
          "lowercase"
        ]
      },
      "confidence": 0.55,
      "summary": "OpenSSL key decoding import",
      "notes": "Engine strips platform symbol decoration before matching. Import presence does not prove invocation, key quality, or production use.",
      "references": [
        "https://docs.openssl.org/3.5/man3/PEM_read_bio_PrivateKey/"
      ]
    },
    {
      "id": "sig.binary-import.crpt-keycheck",
      "atom": "CRPT.KEYCHECK",
      "surface": "binary-import",
      "method": "static-binary",
      "languages": [
        "*"
      ],
      "match": {
        "mode": "exact",
        "values": [
          "evp_pkey_check",
          "evp_pkey_param_check",
          "evp_pkey_param_check_quick",
          "evp_pkey_public_check",
          "evp_pkey_public_check_quick",
          "evp_pkey_private_check",
          "evp_pkey_pairwise_check"
        ],
        "normalize": [
          "lowercase"
        ]
      },
      "confidence": 0.55,
      "summary": "OpenSSL key or parameter validation import",
      "notes": "Engine strips platform symbol decoration before matching. Symbol presence does not prove enforcement; inspect result handling and provider behavior.",
      "references": [
        "https://docs.openssl.org/3.5/man3/EVP_PKEY_check/"
      ]
    },
    {
      "id": "sig.binary-import.exec-shell",
      "atom": "EXEC.SHELL",
      "surface": "binary-import",
      "method": "static-binary",
      "languages": [
        "*"
      ],
      "match": {
        "mode": "substring",
        "values": [
          "system",
          "popen",
          "shellexecute",
          "winexec"
        ]
      },
      "confidence": 0.55,
      "summary": "spawns a shell or runs a command line",
      "notes": "Extracted from bincaps.py _CAP_MAP."
    },
    {
      "id": "sig.binary-import.exec-proc",
      "atom": "EXEC.PROC",
      "surface": "binary-import",
      "method": "static-binary",
      "languages": [
        "*"
      ],
      "match": {
        "mode": "substring",
        "values": [
          "execve",
          "execvp",
          "execl",
          "execlp",
          "posix_spawn",
          "createprocessa",
          "createprocessw"
        ]
      },
      "confidence": 0.55,
      "summary": "creates or replaces a process",
      "notes": "Extracted from bincaps.py _CAP_MAP."
    },
    {
      "id": "sig.binary-import.load-dynamic",
      "atom": "LOAD.DYNAMIC",
      "surface": "binary-import",
      "method": "static-binary",
      "languages": [
        "*"
      ],
      "match": {
        "mode": "substring",
        "values": [
          "dlopen",
          "dlsym",
          "loadlibrarya",
          "loadlibraryw",
          "getprocaddress"
        ]
      },
      "confidence": 0.55,
      "summary": "loads a library or resolves symbols at runtime",
      "notes": "Extracted from bincaps.py _CAP_MAP."
    },
    {
      "id": "sig.binary-import.netw-socket",
      "atom": "NETW.SOCKET",
      "surface": "binary-import",
      "method": "static-binary",
      "languages": [
        "*"
      ],
      "match": {
        "mode": "substring",
        "values": [
          "socket",
          "connect",
          "gethostbyname",
          "getaddrinfo",
          "wsasocket",
          "wsastartup",
          "internetopen",
          "internetconnect",
          "httpsendrequest",
          "urldownloadtofile",
          "winhttpopen",
          "curl_easy_init",
          "inet_addr",
          "inet_pton",
          "recvfrom",
          "sendto"
        ]
      },
      "confidence": 0.55,
      "summary": "opens network sockets or connections",
      "notes": "Extracted from bincaps.py _CAP_MAP."
    },
    {
      "id": "sig.binary-import.sysi-registry",
      "atom": "SYSI.REGISTRY",
      "surface": "binary-import",
      "method": "static-binary",
      "languages": [
        "*"
      ],
      "match": {
        "mode": "substring",
        "values": [
          "regsetvalue",
          "regcreatekey",
          "regopenkey",
          "regqueryvalue",
          "regdeletekey"
        ]
      },
      "confidence": 0.55,
      "summary": "reads or writes the Windows registry",
      "notes": "Extracted from bincaps.py _CAP_MAP."
    },
    {
      "id": "sig.binary-import.prst-service",
      "atom": "PRST.SERVICE",
      "surface": "binary-import",
      "method": "static-binary",
      "languages": [
        "*"
      ],
      "match": {
        "mode": "substring",
        "values": [
          "createservicea",
          "createservicew",
          "startservice",
          "openscmanager"
        ]
      },
      "confidence": 0.55,
      "summary": "installs or controls a service",
      "notes": "Extracted from bincaps.py _CAP_MAP."
    },
    {
      "id": "sig.binary-import.priv-elevate",
      "atom": "PRIV.ELEVATE",
      "surface": "binary-import",
      "method": "static-binary",
      "languages": [
        "*"
      ],
      "match": {
        "mode": "substring",
        "values": [
          "setuid",
          "seteuid",
          "adjusttokenprivileges",
          "openprocesstoken",
          "lookupprivilegevalue"
        ]
      },
      "confidence": 0.55,
      "summary": "changes process privilege or token",
      "notes": "Extracted from bincaps.py _CAP_MAP."
    },
    {
      "id": "sig.binary-import.xfrm-encrypt",
      "atom": "XFRM.ENCRYPT",
      "surface": "binary-import",
      "method": "static-binary",
      "languages": [
        "*"
      ],
      "match": {
        "mode": "substring",
        "values": [
          "cryptacquirecontext",
          "cryptencrypt",
          "bcryptencrypt",
          "evp_encrypt",
          "evp_decrypt",
          "ssl_connect",
          "ssl_new",
          "ssl_write"
        ]
      },
      "confidence": 0.55,
      "summary": "cryptographic primitive",
      "notes": "Extracted from bincaps.py _CAP_MAP."
    },
    {
      "id": "sig.binary-import.fsys-write",
      "atom": "FSYS.WRITE",
      "surface": "binary-import",
      "method": "static-binary",
      "languages": [
        "*"
      ],
      "match": {
        "mode": "substring",
        "values": [
          "writefile",
          "createfilea",
          "createfilew",
          "fwrite",
          "unlink",
          "deletefilea",
          "deletefilew"
        ]
      },
      "confidence": 0.55,
      "summary": "writes or deletes files",
      "notes": "Extracted from bincaps.py _CAP_MAP."
    },
    {
      "id": "sig.binary-import.fsys-read",
      "atom": "FSYS.READ",
      "surface": "binary-import",
      "method": "static-binary",
      "languages": [
        "*"
      ],
      "match": {
        "mode": "substring",
        "values": [
          "readfile",
          "fread",
          "opendir",
          "readdir",
          "findfirstfilea",
          "fopen"
        ]
      },
      "confidence": 0.55,
      "summary": "reads files or directories",
      "notes": "Extracted from bincaps.py _CAP_MAP."
    }
  ]
}
